{
  "version": 1,
  "session": "2027",
  "epreuves": [
    {
      "id": "francais-ecrit",
      "libelle": "Français, épreuve anticipée (écrit)",
      "date": "2027-06-15",
      "modifiable": false,
      "source": {
        "titre": "Éduscol, dates des examens 2027 : épreuve écrite anticipée de français le mardi 15 juin 2027"
      }
    },
    {
      "id": "francais-oral",
      "libelle": "Français, épreuve anticipée (oral)",
      "date": null,
      "modifiable": true
    },
    {
      "id": "philosophie",
      "libelle": "Philosophie (écrit)",
      "date": "2027-06-14",
      "heure": "08:00",
      "modifiable": false,
      "source": {
        "titre": "Calendrier session 2027, annexe III, BO spécial n° 2 du 25 août 2026"
      }
    },
    {
      "id": "ses",
      "libelle": "SES (écrit)",
      "date": "2027-06-16",
      "heure": "08:00",
      "modifiable": true,
      "source": {
        "titre": "Calendrier session 2027 : SES les 16 et 17 juin ; le jour est fixé par la convocation"
      }
    },
    {
      "id": "llcer-ecrit",
      "libelle": "LLCER anglais (écrit)",
      "date": "2027-06-17",
      "heure": "08:00",
      "modifiable": false,
      "source": {
        "titre": "Calendrier session 2027, annexe III, BO spécial n° 2 du 25 août 2026"
      }
    },
    {
      "id": "llcer-oral",
      "libelle": "LLCER anglais (oral)",
      "date": null,
      "modifiable": true
    },
    {
      "id": "grand-oral",
      "libelle": "Grand oral (entre le 21 juin et le 2 juillet)",
      "date": null,
      "modifiable": true
    }
  ],
  "matieres": [
    {
      "id": "francais",
      "nom": "Français (épreuves anticipées)",
      "page": "cours",
      "couleur": {
        "clair": "#9A4A12",
        "sombre": "#F2B27A"
      },
      "icone": "crayon",
      "bac": {
        "evaluation": "epreuve-ecrite-et-orale",
        "coefficient": 10,
        "epreuve": "francais-ecrit"
      },
      "programme": {
        "intitule": "Programme de français de première, voie générale : objets d'étude et œuvres 2026-2027",
        "source": {
          "titre": "Note de service du 4 juillet 2025, programme d'œuvres de français de première pour 2026-2027, BO n° 30 du 24 juillet 2025 (MENE2518792N)",
          "url": "https://www.education.gouv.fr/bo/2025/Hebdo30/MENE2518792N"
        }
      },
      "chapitres": [
        {
          "id": "candidat-libre",
          "titre": "Ta situation : candidat libre et épreuves de français",
          "groupe": "Avant de commencer",
          "fichier": "data/francais/chapitres/candidat-libre.json",
          "exercices": "data/francais/exercices/candidat-libre.json"
        },
        {
          "id": "roman",
          "titre": "Le roman et le récit du Moyen Âge au XXIe siècle",
          "groupe": "Objets d'étude et œuvres au programme 2026-2027",
          "fichier": "data/francais/chapitres/roman.json",
          "exercices": "data/francais/exercices/roman.json"
        },
        {
          "id": "poesie",
          "titre": "La poésie du XIXe au XXIe siècle",
          "groupe": "Objets d'étude et œuvres au programme 2026-2027",
          "fichier": "data/francais/chapitres/poesie.json",
          "exercices": "data/francais/exercices/poesie.json"
        },
        {
          "id": "litterature-idees",
          "titre": "La littérature d'idées du XVIe au XVIIIe siècle",
          "groupe": "Objets d'étude et œuvres au programme 2026-2027",
          "fichier": "data/francais/chapitres/litterature-idees.json",
          "exercices": "data/francais/exercices/litterature-idees.json"
        },
        {
          "id": "theatre",
          "titre": "Le théâtre du XVIIe au XXIe siècle",
          "groupe": "Objets d'étude et œuvres au programme 2026-2027",
          "fichier": "data/francais/chapitres/theatre.json",
          "exercices": "data/francais/exercices/theatre.json"
        },
        {
          "id": "methode-commentaire",
          "titre": "Méthode : le commentaire",
          "groupe": "Méthodes des épreuves",
          "fichier": "data/francais/chapitres/methode-commentaire.json",
          "exercices": "data/francais/exercices/methode-commentaire.json"
        },
        {
          "id": "methode-dissertation",
          "titre": "Méthode : la dissertation",
          "groupe": "Méthodes des épreuves",
          "fichier": "data/francais/chapitres/methode-dissertation.json",
          "exercices": "data/francais/exercices/methode-dissertation.json"
        },
        {
          "id": "methode-oral",
          "titre": "Méthode : l'épreuve orale",
          "groupe": "Méthodes des épreuves",
          "fichier": "data/francais/chapitres/methode-oral.json",
          "exercices": "data/francais/exercices/methode-oral.json"
        },
        {
          "id": "grammaire",
          "titre": "La question de grammaire",
          "groupe": "Méthodes des épreuves",
          "fichier": "data/francais/chapitres/grammaire.json",
          "exercices": "data/francais/exercices/grammaire.json"
        }
      ],
      "glossaire": "data/francais/glossaire.json"
    },
    {
      "id": "ses",
      "nom": "Sciences économiques et sociales",
      "page": "cours",
      "couleur": {
        "clair": "#0F6674",
        "sombre": "#6CCAD6"
      },
      "icone": "courbe",
      "bac": {
        "evaluation": "epreuve-ecrite",
        "coefficient": 16,
        "epreuve": "ses"
      },
      "programme": {
        "intitule": "Programme de l'enseignement de spécialité de SES de la classe terminale",
        "source": {
          "titre": "Arrêté du 19 juillet 2019, BO spécial n° 8 du 25 juillet 2019"
        }
      },
      "chapitres": [
        {
          "id": "croissance",
          "titre": "Quels sont les sources et les défis de la croissance économique ?",
          "groupe": "Science économique",
          "fichier": "data/ses/chapitres/croissance.json",
          "exercices": "data/ses/exercices/croissance.json",
          "evaluableEcrit": true
        },
        {
          "id": "commerce-international",
          "titre": "Quels sont les fondements du commerce international et de l'internationalisation de la production ?",
          "groupe": "Science économique",
          "fichier": "data/ses/chapitres/commerce-international.json",
          "exercices": "data/ses/exercices/commerce-international.json",
          "evaluableEcrit": true
        },
        {
          "id": "chomage",
          "titre": "Comment lutter contre le chômage ?",
          "groupe": "Science économique",
          "fichier": "data/ses/chapitres/chomage.json",
          "exercices": "data/ses/exercices/chomage.json",
          "evaluableEcrit": true
        },
        {
          "id": "crises-financieres",
          "titre": "Comment expliquer les crises financières et réguler le système financier ?",
          "groupe": "Science économique",
          "fichier": "data/ses/chapitres/crises-financieres.json",
          "exercices": "data/ses/exercices/crises-financieres.json",
          "evaluableEcrit": false
        },
        {
          "id": "politiques-europeennes",
          "titre": "Quelles politiques économiques dans le cadre européen ?",
          "groupe": "Science économique",
          "fichier": "data/ses/chapitres/politiques-europeennes.json",
          "exercices": "data/ses/exercices/politiques-europeennes.json",
          "evaluableEcrit": true
        },
        {
          "id": "structure-sociale",
          "titre": "Comment est structurée la société française actuelle ?",
          "groupe": "Sociologie et science politique",
          "fichier": "data/ses/chapitres/structure-sociale.json",
          "exercices": "data/ses/exercices/structure-sociale.json",
          "evaluableEcrit": true
        },
        {
          "id": "ecole",
          "titre": "Quelle est l'action de l'École sur les destins individuels et sur l'évolution de la société ?",
          "groupe": "Sociologie et science politique",
          "fichier": "data/ses/chapitres/ecole.json",
          "exercices": "data/ses/exercices/ecole.json",
          "evaluableEcrit": false
        },
        {
          "id": "mobilite-sociale",
          "titre": "Quelles sont les caractéristiques contemporaines et les facteurs de la mobilité sociale ?",
          "groupe": "Sociologie et science politique",
          "fichier": "data/ses/chapitres/mobilite-sociale.json",
          "exercices": "data/ses/exercices/mobilite-sociale.json",
          "evaluableEcrit": true
        },
        {
          "id": "travail-emploi",
          "titre": "Quelles mutations du travail et de l'emploi ?",
          "groupe": "Sociologie et science politique",
          "fichier": "data/ses/chapitres/travail-emploi.json",
          "exercices": "data/ses/exercices/travail-emploi.json",
          "evaluableEcrit": true
        },
        {
          "id": "engagement-politique",
          "titre": "Comment expliquer l'engagement politique dans les sociétés démocratiques ?",
          "groupe": "Sociologie et science politique",
          "fichier": "data/ses/chapitres/engagement-politique.json",
          "exercices": "data/ses/exercices/engagement-politique.json",
          "evaluableEcrit": true
        },
        {
          "id": "justice-sociale",
          "titre": "Quelles inégalités sont compatibles avec les différentes conceptions de la justice sociale ?",
          "groupe": "Regards croisés",
          "fichier": "data/ses/chapitres/justice-sociale.json",
          "exercices": "data/ses/exercices/justice-sociale.json",
          "evaluableEcrit": false
        },
        {
          "id": "environnement",
          "titre": "Quelle action publique pour l'environnement ?",
          "groupe": "Regards croisés",
          "fichier": "data/ses/chapitres/environnement.json",
          "exercices": "data/ses/exercices/environnement.json",
          "evaluableEcrit": true